{
  "$schema": "https://json-schema.org/draft/2020-12/schema#",
  "title": "Board",
  "description": "...",
  "type": "object",
  "properties": {
    "__metadata__": {
      "$ref": "./metadata.json"
    },
    "tasks": {
      "description": "An array of Task objects",
      "type": "array",
      "items": {
        "$ref": "./task.json"
      }
    },
    "events": {
      "description": "An array of Event objects",
      "type": "array",
      "items": {
        "$ref": "./event.json"
      }
    },
    "task_generators": {
      "description": "An array of TaskGenerator objects",
      "type": "array"
    },
    "event_generators": {
      "description": "An array of EventGenerator objects",
      "type": "array"
    }
  },
  "required": [
    "__metadata__",
    "tasks",
    "events",
    "task_generators",
    "event_generators"
  ],
  "additionalProperties": false
}