{
  "__metadata__": {
    "board_bee_version": 0.0,
    "name": "School",
    "labels": {},
    "flags": []
  },
  "tasks": [],
  "events": [],
  "task_generators": [],
  "event_generators": [
    "https://www.kanzaki.com/docs/ical/rrule.html",
    {
      "name": "Thanksgiving",
      "start_dates": {
        "start": "1941-11-27 00:00:00",
        "end": "1941-11-27 23:59:59"
      },
      "recurrence_rule": {
        "frequency_mode": "yearly",
        "filters": {
          "months": [11],
          "weekdays": ["thursday"],
          "set_pos": [4]
        }
      }
    },
    {
      "name": "Election Day",
      "start_dates": {
        "start": "1996-11-05 00:00:00",
        "end": "1996-11-05 23:59:59"
      },
      "recurrence_rule": {
        "frequency_mode": "yearly",
        "interval": 4,
        "filters": {
          "months": [11],
          "weekdays": ["tuesday"],
          "month_days": [2, 3, 4, 5, 6, 7, 8]
        }
      }
    }
  ]
}